f3f35200 3853812304 S Co:1:015:0 s 40 13 6ac8 0018 0012 18 = 003b003b 003b003b 000c0014 03ff04ff 0419
f3f35200 3854023239 C Co:1:015:0 0 18 >
f3f35200 3854029110 S Co:1:015:0 s 40 14 3095 0000 0000 0
f3f35200 3854030739 C Co:1:015:0 0 0
f3f35200 3854037172 S Ci:1:015:0 s c0 12 03e8 0000 0002 2 <
f3f35200 3854038239 C Ci:1:015:0 0 2 = deee
f3f35200 3854056861 S Bi:1:015:2 -115 16384 <
f3f35200 3855024864 C Bi:1:015:2 0 16384 = 000000ff ffffffff ffffffff ffffffff ffffffff ffffffff ffffffff ffffffff
ec0b6200 3855038811 S Bi:1:015:2 -115 16384 <
ec0b6200 3855040114 C Bi:1:015:2 0 16384 = ffffffff ffffffff ffffffff ffffffff ffffffff ffffffff ffffffff ffffffff
ec0b6200 3855041804 S Bi:1:015:2 -115 16384 <
ec0b6200 3855042864 C Bi:1:015:2 0 16384 = ffffffff ffffffff ffffffff ffffffff ffffffff ffffffff ffffffff ffffffff
ec0b6200 3855044828 S Bi:1:015:2 -115 16384 <
ec0b6200 3855045989 C Bi:1:015:2 0 16384 = ffffffff ffffffff ffffffff ffffffff ffffffff ffffffff ffffffff ffffffff
ec0b6200 3855047771 S Bi:1:015:2 -115 16384 <
ec0b6200 3855048864 C Bi:1:015:2 0 16384 = ffffffff ffffffff ffffffff ffffffff ffffffff ffffffff ffffffff ffffffff
ec0b6200 3855051435 S Bi:1:015:2 -115 16384 <
ec0b6200 3855052490 C Bi:1:015:2 0 16384 = ffffffff ffffffff ffffffff ffffffff ffffffff ffffffff ffffffff ffffffff
ec0b6200 3855053819 S Bi:1:015:2 -115 16384 <
ec0b6200 3855054989 C Bi:1:015:2 0 16384 = ffffffff ffffffff ffffffff ffffffff ffffffff ffffffff ffffffff ffffffff
ec0b6200 3855056843 S Bi:1:015:2 -115 16384 <
ec0b6200 3855057989 C Bi:1:015:2 0 16384 = ffffffff ffffffff ffffffff ffffffff ffffffff ffffffff ffffffff ffffffff
ec0b6200 3855059787 S Bi:1:015:2 -115 16384 <
ec0b6200 3855060865 C Bi:1:015:2 0 16384 = ffffffff ffffffff ffffffff ffffffff ffffffff ffffffff ffffffff ffffffff
ec0b6200 3855062811 S Bi:1:015:2 -115 16384 <
ec0b6200 3855063864 C Bi:1:015:2 0 16384 = ffffffff ffffffff ffffffff ffffffff ffffffff ffffffff ffffffff ffffffff
ec0b6200 3855065835 S Bi:1:015:2 -115 16384 <
ec0b6200 3855066865 C Bi:1:015:2 0 16384 = ffffffff ffffffff ffffffff ffffffff ffffffff ffffffff ffffffff ffffffff
ec0b6200 3855068779 S Bi:1:015:2 -115 16384 <
ec0b6200 3855069864 C Bi:1:015:2 0 16384 = ffffffff ffffffff ffffffff ffffffff ffffffff ffffffff ffffffff ffffffff
ec0b6200 3855071803 S Bi:1:015:2 -115 16384 <
ec0b6200 3855072864 C Bi:1:015:2 0 16384 = ffffffff ffffffff ffffffff ffffffff ffffffff ffffffff ffffffff ffffffff
ec0b6200 3855074828 S Bi:1:015:2 -115 16384 <
ec0b6200 3855075864 C Bi:1:015:2 0 16384 = ffffffff ffffffff ffffffff ffffffff ffffffff ffffffff ffffffff ffffffff
ec0b6200 3855077771 S Bi:1:015:2 -115 16384 <
ec0b6200 3855078864 C Bi:1:015:2 0 16384 = ffffffff ffffffff ffffffff ffffffff ffffffff ffffffff ffffffff ffffffff
ec0b6200 3855080796 S Bi:1:015:2 -115 16384 <
ec0b6200 3855081864 C Bi:1:015:2 0 16384 = ffffffff ffffffff ffffffff ffffffff ffffffff ffffffff ffffffff ffffffff
ec0b6200 3855083821 S Bi:1:015:2 -115 16384 <
ec0b6200 3855084864 C Bi:1:015:2 0 16384 = ffffffff ffffffff ffffffff ffffffff ffffffff ffffffff ffffffff ffffffff
ec0b6200 3855086842 S Bi:1:015:2 -115 16384 <
ec0b6200 3855087989 C Bi:1:015:2 0 16384 = ffffffff ffffffff ffffffff ffffffff ffffffff ffffffff ffffffff ffffffff
ec0b6200 3855089788 S Bi:1:015:2 -115 16384 <
ec0b6200 3855090864 C Bi:1:015:2 0 16384 = ffffffff ffffffff ffffffff ffffffff ffffffff ffffffff ffffffff ffffffff
ec0b6200 3855092810 S Bi:1:015:2 -115 16384 <
ec0b6200 3855093865 C Bi:1:015:2 0 16384 = ffffffff ffffffff ffffffff ffffffff ffffffff ffffffff ffffffff ffffffff
ec0b6200 3855095834 S Bi:1:015:2 -115 16384 <
ec0b6200 3855096864 C Bi:1:015:2 0 16384 = ffffffff ffffffff ffffffff ffffffff ffffffff ffffffff ffffffff ffffffff
ec0b6200 3855098779 S Bi:1:015:2 -115 16384 <
ec0b6200 3855099864 C Bi:1:015:2 0 16384 = ffffffff ffffffff ffffffff ffffffff ffffffff ffffffff ffffffff ffffffff
f542be00 3855101805 S Bi:1:015:2 -115 16384 <
f542be00 3855102864 C Bi:1:015:2 0 16384 = ffffffff ffffffff ffffffff ffffffff ffffffff ffffffff ffffffff ffffffff
f542be00 3855104826 S Bi:1:015:2 -115 16384 <
f542be00 3855105864 C Bi:1:015:2 0 16384 = ffffffff ffffffff ffffffff ffffffff ffffffff ffffffff ffffffff ffffffff
f542be00 3855107772 S Bi:1:015:2 -115 16384 <
f542be00 3855108864 C Bi:1:015:2 0 16384 = ffffffff ffffffff ffffffff ffffffff ffffffff ffffffff ffffffff ffffffff
ec0b6c00 3855111442 S Bi:1:015:2 -115 16384 <
ec0b6c00 3855112622 C Bi:1:015:2 0 16384 = ffffffff ffffffff ffffffff ffffffff ffffffff ffffffff ffffffff ffffffff
ec0b6400 3855113821 S Bi:1:015:2 -115 16384 <
ec0b6400 3855114864 C Bi:1:015:2 0 16384 = ffffffff ffffffff ffffffff ffffffff ffffffff ffffffff ffffffff ffffffff
f3f5b000 3855117920 S Bi:1:015:2 -115 16384 <
f3f5b000 3855119114 C Bi:1:015:2 0 16384 = ffffffff ffffffff ffffffff ffffffff ffffffff ffffffff ffffffff ffffffff
f1d0bb80 3855120426 S Bi:1:015:2 -115 16384 <
f1d0bb80 3855121489 C Bi:1:015:2 0 16384 = ffffffff ffffffff ffffffff ffffffff ffffffff ffffffff ffffffff ffffffff
f1d0bb80 3855123451 S Bi:1:015:2 -115 16384 <
f1d0bb80 3855124614 C Bi:1:015:2 0 16384 = ffffffff ffffffff ffffffff ffffffff ffffffff ffffffff ffffffff ffffffff
f2660f80 3855126474 S Bi:1:015:2 -115 16384 <
f2660f80 3855127615 C Bi:1:015:2 0 16384 = ffffffff ffffffff ffffffff ffffffff ffffffff ffffffff ffffffff ffffffff
f2660f80 3855129418 S Bi:1:015:2 -115 16384 <
f2660f80 3855130489 C Bi:1:015:2 0 16384 = ffffffff ffffffff ffffffff ffffffff ffffffff ffffffff ffffffff ffffffff
f1d0b380 3855132442 S Bi:1:015:2 -115 16384 <
f1d0b380 3855133614 C Bi:1:015:2 0 16384 = ffffffff ffffffff ffffffff ffffffff ffffffff ffffffff ffffffff ffffffff
f1d0b380 3855135464 S Bi:1:015:2 -115 16384 <
f1d0b380 3855136614 C Bi:1:015:2 0 16384 = ffffffff ffffffff ffffffff ffffffff ffffffff ffffffff ffffffff ffffffff
f1d0b380 3855138409 S Bi:1:015:2 -115 16384 <
f1d0b380 3855139489 C Bi:1:015:2 0 16384 = ffffffff ffffffff ffffffff ffffffff ffffffff ffffffff ffffffff ffffffff
f1d0b380 3855141432 S Bi:1:015:2 -115 16384 <
f1d0b380 3855142489 C Bi:1:015:2 0 16384 = ffffffff ffffffff ffffffff ffffffff ffffffff ffffffff ffffffff ffffffff
f1d0b380 3855144457 S Bi:1:015:2 -115 16384 <
f1d0b380 3855145614 C Bi:1:015:2 0 16384 = ffffffff ffffffff ffffffff ffffffff ffffffff ffffffff ffffffff ffffffff
f1d0b380 3855147401 S Bi:1:015:2 -115 16384 <
f1d0b380 3855148489 C Bi:1:015:2 0 16384 = ffffffff ffffffff ffffffff ffffffff ffffffff ffffffff ffffffff ffffffff
f1d0b380 3855150424 S Bi:1:015:2 -115 16384 <
f1d0b380 3855151489 C Bi:1:015:2 0 16384 = ffffffff ffffffff ffffffff ffffffff ffffffff ffffffff ffffffff ffffffff
f1d0b380 3855153448 S Bi:1:015:2 -115 16384 <
f1d0b380 3855154614 C Bi:1:015:2 0 16384 = ffffffff ffffffff ffffffff ffffffff ffffffff ffffffff ffffffff ffffffff
f1d0b380 3855156473 S Bi:1:015:2 -115 16384 <
f1d0b380 3855157614 C Bi:1:015:2 0 16384 = ffffffff ffffffff ffffffff ffffffff ffffffff ffffffff ffffffff ffffffff
f1d0b380 3855159417 S Bi:1:015:2 -115 16384 <
f1d0b380 3855160489 C Bi:1:015:2 0 16384 = ffffffff ffffffff ffffffff ffffffff ffffffff ffffffff ffffffff ffffffff
f1d0b380 3855162440 S Bi:1:015:2 -115 16384 <
f1d0b380 3855163614 C Bi:1:015:2 0 16384 = ffffffff ffffffff ffffffff ffffffff ffffffff ffffffff ffffffff ffffffff
f1d0b380 3855165464 S Bi:1:015:2 -115 16384 <
f1d0b380 3855166614 C Bi:1:015:2 0 16384 = ffffffff ffffffff ffffffff ffffffff ffffffff ffffffff ffffffff ffffffff
f1d0b380 3855168409 S Bi:1:015:2 -115 16384 <
f1d0b380 3855169489 C Bi:1:015:2 0 16384 = ffffffff ffffffff ffffffff ffffffff ffffffff ffffffff ffffffff ffffffff
f1d0b380 3855171432 S Bi:1:015:2 -115 16384 <
f1d0b380 3855172489 C Bi:1:015:2 0 16384 = ffffffff ffffffff ffffffff ffffffff ffffffff ffffffff ffffffff ffffffff
f1d0b380 3855174456 S Bi:1:015:2 -115 16384 <
f1d0b380 3855175614 C Bi:1:015:2 0 16384 = ffffffff ffffffff ffffffff ffffffff ffffffff ffffffff ffffffff ffffffff
f1d0b380 3855177401 S Bi:1:015:2 -115 16384 <
f1d0b380 3855178489 C Bi:1:015:2 0 16384 = ffffffff ffffffff ffffffff ffffffff ffffffff ffffffff ffffffff ffffffff
f1d0b380 3855180425 S Bi:1:015:2 -115 16384 <
f1d0b380 3855181489 C Bi:1:015:2 0 16384 = ffffffff ffffffff ffffffff ffffffff ffffffff ffffffff ffffffff ffffffff
f1d0b380 3855183449 S Bi:1:015:2 -115 16384 <
f1d0b380 3855184614 C Bi:1:015:2 0 16384 = ffffffff ffffffff ffffffff ffffffff ffffffff ffffffff ffffffff ffffffff
f1d0b380 3855186474 S Bi:1:015:2 -115 16384 <
f1d0b380 3855187614 C Bi:1:015:2 0 16384 = ffffffff ffffffff ffffffff ffffffff ffffffff ffffffff ffffffff ffffffff
f1d0b380 3855189417 S Bi:1:015:2 -115 16384 <
f1d0b380 3855190489 C Bi:1:015:2 0 16384 = ffffffff ffffffff ffffffff ffffffff ffffffff ffffffff ffffffff ffffffff
f1d0b380 3855192441 S Bi:1:015:2 -115 16384 <
f1d0b380 3855193614 C Bi:1:015:2 0 16384 = ffffffff ffffffff ffffffff ffffffff ffffffff ffffffff ffffffff ffffffff
f1d0b380 3855195464 S Bi:1:015:2 -115 16384 <
f1d0b380 3855196614 C Bi:1:015:2 0 16384 = ffffffff ffffffff ffffffff ffffffff ffffffff ffffffff ffffffff ffffffff
f1d0b380 3855198408 S Bi:1:015:2 -115 16384 <
f1d0b380 3855199489 C Bi:1:015:2 0 16384 = ffffffff ffffffff ffffffff ffffffff ffffffff ffffffff ffffffff ffffffff
f1d0b380 3855201432 S Bi:1:015:2 -115 16384 <
f1d0b380 3855202489 C Bi:1:015:2 0 16384 = ffffffff ffffffff ffffffff ffffffff ffffffff ffffffff ffffffff ffffffff
f2660c80 3855204457 S Bi:1:015:2 -115 16384 <
f2660c80 3855205614 C Bi:1:015:2 0 16384 = ffffffff ffffffff ffffffff ffffffff ffffffff ffffffff ffffffff ffffffff
f2660c80 3855207403 S Bi:1:015:2 -115 16384 <
f2660c80 3855208489 C Bi:1:015:2 0 16384 = ffffffff ffffffff ffffffff ffffffff ffffffff ffffffff ffffffff ffffffff
f2660c80 3855210425 S Bi:1:015:2 -115 16384 <
f2660c80 3855211489 C Bi:1:015:2 0 16384 = ffffffff ffffffff ffffffff ffffffff ffffffff ffffffff ffffffff ffffffff
f2660c80 3855213450 S Bi:1:015:2 -115 16384 <
f2660c80 3855214614 C Bi:1:015:2 0 16384 = ffffffff ffffffff ffffffff ffffffff ffffffff ffffffff ffffffff ffffffff
f2660c80 3855216473 S Bi:1:015:2 -115 16384 <
f2660c80 3855217614 C Bi:1:015:2 0 16384 = ffffffff ffffffff ffffffff ffffffff ffffffff ffffffff ffffffff ffffffff
f2660c80 3855219417 S Bi:1:015:2 -115 16384 <
f2660c80 3855220489 C Bi:1:015:2 0 16384 = ffffffff ffffffff ffffffff ffffffff ffffffff ffffffff ffffffff ffffffff
f2660c80 3855222440 S Bi:1:015:2 -115 16384 <
f2660c80 3855223614 C Bi:1:015:2 0 16384 = ffffffff ffffffff ffffffff ffffffff ffffffff ffffffff ffffffff ffffffff
f2660c80 3855225464 S Bi:1:015:2 -115 16384 <
f2660c80 3855226614 C Bi:1:015:2 0 16384 = ffffffff ffffffff ffffffff ffffffff ffffffff ffffffff ffffffff ffffffff
f2660c80 3855228409 S Bi:1:015:2 -115 16384 <
f2660c80 3855229489 C Bi:1:015:2 0 16384 = ffffffff ffffffff ffffffff ffffffff ffffffff ffffffff ffffffff ffffffff
f2660c80 3855231432 S Bi:1:015:2 -115 16384 <
f2660c80 3855232488 C Bi:1:015:2 0 16384 = ffffffff ffffffff ffffffff ffffffff ffffffff ffffffff ffffffff ffffffff
f2660c80 3855234456 S Bi:1:015:2 -115 16384 <
f2660c80 3855235614 C Bi:1:015:2 0 16384 = ffffffff ffffffff ffffffff ffffffff ffffffff ffffffff ffffffff ffffffff
f2660c80 3855237401 S Bi:1:015:2 -115 16384 <
f2660c80 3855238489 C Bi:1:015:2 0 16384 = ffffffff ffffffff ffffffff ffffffff ffffffff ffffffff ffffffff ffffffff
f2660c80 3855240425 S Bi:1:015:2 -115 16384 <
f2660c80 3855241489 C Bi:1:015:2 0 16384 = ffffffff ffffffff ffffffff ffffffff ffffffff ffffffff ffffffff ffffffff
f2660c80 3855243448 S Bi:1:015:2 -115 16384 <
f2660c80 3855244614 C Bi:1:015:2 0 16384 = ffffffff ffffffff ffffffff ffffffff ffffffff ffffffff ffffffff ffffffff
f2660c80 3855246473 S Bi:1:015:2 -115 16384 <
f2660c80 3855247614 C Bi:1:015:2 0 16384 = ffffffff ffffffff ffffffff ffffffff ffffffff ffffffff ffffffff ffffffff
f2660c80 3855249420 S Bi:1:015:2 -115 16384 <
f2660c80 3855250490 C Bi:1:015:2 0 16384 = ffffffff ffffffff ffffffff ffffffff ffffffff ffffffff ffffffff ffffffff
f2660c80 3855252444 S Bi:1:015:2 -115 16384 <
f2660c80 3855253615 C Bi:1:015:2 0 16384 = ffffffff ffffffff ffffffff ffffffff ffffffff ffffffff ffffffff ffffffff
f2660c80 3855255468 S Bi:1:015:2 -115 16384 <
f2660c80 3855256614 C Bi:1:015:2 0 16384 = ffffffff ffffffff ffffffff ffffffff ffffffff ffffffff ffffffff ffffffff
f2660c80 3855258410 S Bi:1:015:2 